{
  "datasetVersion": "1.0",
  "name": "LAFRYHI AI Radar Gemini Migration",
  "description": "Synthetic, concise cases for deterministic migration evaluation. No private or copyrighted source bodies.",
  "cases": [
    {"id":"official-google-announcement","category":"official-source","language":"en","smokeTest":true,"source":{"title":"Google announces a controlled AI API update","url":"https://example.test/google-update","publisher":"Google","publishedAt":"2026-07-01T10:00:00Z","content":"Google announced that its synthetic Example API will become generally available on August 15, 2026. The announcement states that requests will support structured JSON responses and that existing preview users must review the migration guide. No pricing claim was included."},"businessContext":{"industry":"Retail","companySize":"SMALL","aiMaturity":"PILOTING","businessGoals":["Improve support response time"],"currentTools":["Help desk"],"budgetRange":"1K_TO_10K","riskTolerance":"MODERATE"},"expectations":{"minimumEvidenceCount":1,"expectedStatus":"accepted","allowedDecisionValues":["RUN_EXPERIMENT","MONITOR"],"requiredKeywords":[],"requiredKeywordAlternatives":[["API","APIs","application programming interface"]],"forbiddenKeywords":["guaranteed profit"],"mustReturnInsufficientEvidence":false},"tags":["official","english"]},
    {"id":"long-press-article","category":"press","language":"en","source":{"title":"Synthetic press analysis of AI adoption","url":"https://example.test/press-analysis","publisher":"Example Press","publishedAt":"2026-06-20T08:00:00Z","content":"A synthetic survey of 120 small firms reported that 48 firms tested AI support tools during the first half of 2026. Twenty firms reported shorter response times, while twelve reported no measurable change. The article states that methods were self-reported and does not claim causation. Analysts requested longer follow-up periods before broad conclusions."},"businessContext":{"industry":"Services","companySize":"SMALL","aiMaturity":"EXPLORING","businessGoals":["Evaluate AI support"],"currentTools":[],"budgetRange":"UNDER_1K","riskTolerance":"LOW"},"expectations":{"minimumEvidenceCount":2,"expectedStatus":"pending","allowedDecisionValues":["RUN_EXPERIMENT","MONITOR","DEFER"],"requiredKeywords":["survey"],"forbiddenKeywords":["all firms"],"mustReturnInsufficientEvidence":false},"tags":["long-form","numbers"]},
    {"id":"weak-unverifiable-claim","category":"weak-claim","language":"en","source":{"title":"Anonymous claim about a secret model","url":"https://example.test/anonymous-claim","publisher":"Anonymous Blog","publishedAt":"2026-07-02T09:00:00Z","content":"An unnamed person says a secret model will replace every business application next month. The post gives no company statement, document, date, benchmark, named witness, or reproducible evidence. It asks readers to buy a course immediately and treats speculation as certainty."},"businessContext":{"industry":"Retail","companySize":"MICRO","aiMaturity":"NONE","businessGoals":["Avoid misinformation"],"currentTools":[],"budgetRange":"NO_BUDGET","riskTolerance":"LOW"},"expectations":{"minimumEvidenceCount":0,"expectedStatus":"rejected","allowedDecisionValues":[],"requiredKeywords":[],"forbiddenKeywords":["confirmed"],"mustReturnInsufficientEvidence":true},"tags":["weak","reject"]},
    {"id":"contradictory-source","category":"contradictory","language":"en","source":{"title":"Conflicting availability statements","url":"https://example.test/conflict","publisher":"Example Vendor","publishedAt":"2026-07-03T11:00:00Z","content":"The release note says Example Assistant is available to all paid accounts on July 3. A correction in the same document says availability is limited to invited accounts and a broader date has not been announced. Both statements remain visible, so the source is internally contradictory."},"businessContext":{"industry":"Consulting","companySize":"SMALL","aiMaturity":"EXPLORING","businessGoals":["Plan tool adoption"],"currentTools":["CRM"],"budgetRange":"1K_TO_10K","riskTolerance":"MODERATE"},"expectations":{"minimumEvidenceCount":2,"expectedStatus":"pending","allowedDecisionValues":["MONITOR","DEFER"],"requiredKeywords":["limited"],"forbiddenKeywords":["available to everyone"],"mustReturnInsufficientEvidence":false},"tags":["conflict","pending"]},
    {"id":"insufficient-evidence","category":"insufficient","language":"en","source":{"title":"Coming soon notice","url":"https://example.test/coming-soon","publisher":"Example Lab","publishedAt":"2026-07-04T12:00:00Z","content":"Something new is coming soon. The notice does not identify a product, capability, release date, audience, evidence, terms, or action. Readers are invited to return later. There is not enough information to evaluate business relevance or make a supported recommendation."},"businessContext":{"industry":"Retail","companySize":"SOLO","aiMaturity":"NONE","businessGoals":["Track relevant releases"],"currentTools":[],"budgetRange":"UNKNOWN","riskTolerance":"LOW"},"expectations":{"minimumEvidenceCount":0,"expectedStatus":"pending","allowedDecisionValues":[],"requiredKeywords":[],"forbiddenKeywords":[],"mustReturnInsufficientEvidence":true},"tags":["insufficient"]},
    {"id":"arabic-policy-update","category":"multilingual","language":"ar","source":{"title":"تحديث اصطناعي لسياسة الذكاء الاصطناعي","url":"https://example.test/ar-policy","publisher":"هيئة تجريبية","publishedAt":"2026-07-05T10:00:00Z","content":"أعلنت الهيئة التجريبية أن الإرشادات الجديدة ستدخل حيز التنفيذ في الأول من سبتمبر 2026. تطلب الإرشادات توثيق مراجعة بشرية للقرارات الآلية عالية التأثير. هذا النص اصطناعي ومخصص للاختبار، ولا يتضمن بيانات شخصية أو أسراراً."},"businessContext":{"industry":"Services","companySize":"SMALL","aiMaturity":"PILOTING","businessGoals":["Maintain human review"],"currentTools":["Workflow"],"budgetRange":"1K_TO_10K","riskTolerance":"LOW"},"expectations":{"minimumEvidenceCount":1,"expectedStatus":"accepted","allowedDecisionValues":["ACT_NOW","MONITOR"],"requiredKeywords":["2026"],"forbiddenKeywords":[],"mustReturnInsufficientEvidence":false},"tags":["arabic","policy"]},
    {"id":"french-platform-update","category":"multilingual","language":"fr","source":{"title":"Mise à jour synthétique d'une plateforme","url":"https://example.test/fr-update","publisher":"Plateforme Exemple","publishedAt":"2026-07-06T10:00:00Z","content":"La plateforme Exemple annonce une nouvelle exportation JSON disponible le 20 août 2026. La documentation précise que la fonction reste optionnelle et que les intégrations existantes continuent de fonctionner. Aucun gain financier ni résultat commercial n'est garanti."},"businessContext":{"industry":"Commerce","companySize":"MICRO","aiMaturity":"EXPLORING","businessGoals":["Simplifier les exports"],"currentTools":["Tableur"],"budgetRange":"UNDER_1K","riskTolerance":"MODERATE"},"expectations":{"minimumEvidenceCount":1,"expectedStatus":"accepted","allowedDecisionValues":["RUN_EXPERIMENT","MONITOR"],"requiredKeywords":["JSON"],"forbiddenKeywords":["garanti"],"mustReturnInsufficientEvidence":false},"tags":["french","platform"]},
    {"id":"english-exact-quotation","category":"quotation","language":"en","source":{"title":"Exact quotation contract","url":"https://example.test/exact-quote","publisher":"Example Docs","publishedAt":"2026-07-07T10:00:00Z","content":"The exact documented statement is: Structured export is available for test workspaces. Production workspaces are not included. This synthetic source requires evidence quotations to reproduce words found in the source rather than invented or paraphrased quotations."},"businessContext":{"industry":"Software","companySize":"SMALL","aiMaturity":"PILOTING","businessGoals":["Test structured export"],"currentTools":["Test workspace"],"budgetRange":"1K_TO_10K","riskTolerance":"MODERATE"},"expectations":{"minimumEvidenceCount":1,"expectedStatus":"pending","allowedDecisionValues":["RUN_EXPERIMENT","MONITOR"],"requiredKeywords":["Structured export"],"forbiddenKeywords":["production release"],"mustReturnInsufficientEvidence":false},"tags":["english","exact-quote"]},
    {"id":"multiple-evidence-references","category":"evidence","language":"en","source":{"title":"Two-part synthetic release","url":"https://example.test/two-part","publisher":"Example Cloud","publishedAt":"2026-07-08T10:00:00Z","content":"Example Cloud released batch processing for test accounts on July 8, 2026. The release note also states that each batch is limited to 500 synthetic records. A separate sentence warns that service-level guarantees do not apply during the test period."},"businessContext":{"industry":"Analytics","companySize":"SMALL","aiMaturity":"PILOTING","businessGoals":["Process test records"],"currentTools":["Data warehouse"],"budgetRange":"10K_TO_50K","riskTolerance":"MODERATE"},"expectations":{"minimumEvidenceCount":2,"expectedStatus":"accepted","allowedDecisionValues":["RUN_EXPERIMENT","MONITOR"],"requiredKeywords":["500"],"forbiddenKeywords":["unlimited"],"mustReturnInsufficientEvidence":false},"tags":["multiple-evidence"]},